Id,EssaySet,Score1,Score2,EssayText
8836,4,0,0,"I believe the word ""invasive"" means a lethal because they talk and obout all this sipecies that can kill us and eat us."
8837,4,1,2,"The title of the story mentioned the word ""invasive"", the word has an important significance to the rest of the article. The author included the positive and negative side of the reptile argument to eliminate bias. Invasive refers to the negative side. As the author noted, biologists say that invasive species inherited by natural predators are major threats to biodiversity.The word invasive refers to this argument that new reptiles are dangerous."
8838,4,0,0,"The word ""invasive"" is used as a term. ""Invasive species"", which some people think it's a bad introduction for an animal. They also think it's a passing judgement."
8839,4,2,2,"The word ""invasive"" had great significance in the article. It is used to describe species who, like the Burmese python, colonize in a region other than their native land. They are also not welcome in these places, as they disrupt nature by dominating, a region where they have no predators. I.e Hence the term ""invasive."""
8840,4,1,1,"In the article the word ""invasive"" means intrusive. By this, I mean that the animals themselves introduce themselves to the new environment. In the text it states, even the term 'invasive species' is anfair,... They're 'introduced'. This quote means that some pislogists see that people themselves bring these animals to a new environment. On the other hand, people see that these species/animals are doing it themselves being ""invasive""."
8841,4,1,1,Invasive implies that the species is a problem. The whole article is explaining how the python can a problem. Like how the python can populate half the continental U.S or how the python has no natural enemies here.
8843,4,1,1,The significance of the word invasive is that many animals like pythons are invading other territories because they can survive in many places. With that some endangered animals could become extinct due to pythons eating them for food.
8844,4,0,0,"The signifificance of the word ""invasive"" to the rest of the article is that their talking about the snakes. In the article it says. "" ...invasive species...pythons"" (in paragraph 7-8)."
8845,4,0,0,Invasive possibly means uncontrolable.They arent like cats and dogs and other species. They showed through out the article that these creatures are dangerous. Paragraph 2.13 &14.
8846,4,1,1,"The significance of the word ""invasive"" is to show how all these different reptiles are growing in population. ""The Burmese python, which is breeding up a storm in the Everglades."" They are in a sense, invaiding the country from spawmog all over."
8847,4,1,1,"Invasive  is important to the rest of the articles because some people think the word "" invasive"" is passing judgment of reptiles. Those people such as Macinnes think that it's the best thing to happen in the everglades. While others think it's horrible and they call them ""invasive"""
8848,4,0,0,The term invasive in (paragrap 7) is used as passing judgement. It's like negative way of judging animals from the wildlife without even knowing how they are like.
8849,4,1,1,"The word invasive, means that they are invading spaces where they should not be. The invasive species are changing the biodiversity. For example pythons are invading Florida and other southern states."
8850,4,1,1,The word invasive is significant in this article. This article talks about how the increase of Burmese pythons is threatening five endangered species in the Florida keys. Also how the snakes are pulled off road ways & caring the spiecies invasive.
8851,4,1,1,"The word ""invasive"" mean the way something act. However, biologist say that invasive species, unchecked by natural predators, are major threats to biodiversity."
8852,4,1,1,The author states he feels the snakes were introduced and that the word invasive is passing judgement on the controry biologists say that invasive species with no natural predators are major threats to biodiversity.
8854,4,1,1,"The significance of the word ""invasive"" means like taking over. In this article they use the word invasive as saying the generalists are taking up or taking over certain parts of U.S. This quote, ""Even the term ""invasive species"" is unfair."" Made people feel like the way they used invasive to generalist was disrespectful, and didn't like it very much."
8855,4,1,0,"The significance of the word invasive means that something is different or odd. In the article Mac Innes says, ""Event the term invasive species is unfair, they're introduced. I think that 'invasive' is passing judgement"". Also the articles title is one man's pet, another's invasive species. This is what I think invasive means and how it is significant."
8856,4,1,1,"The significance of the word ""invasive"" to the rest of the article is that it means most animals are becoming extinct because of the snakes that have been lose. The snakes are eating most of the animals."
8857,4,1,1,"The word ''invasive'' is significant to this short article because people are saying that snakes are dangerous species that shouldn't be considered pets even though the article is saying some good things about them. For example, in paragraph nine, the author says that invasive species are major threats to biodiversity. People think pythons are invasive and that is the significance of the word."
8858,4,1,1,"In the article invasive means that isn't native to an area, comes there, and spreads basically ""invading"" that area. In P5, it says ""invasive species, such as the Burmese python, which is breeding up a storm in the everglades"""
8859,4,1,1,"In the article MacInnes says ""invasive species"" is unfair"". 'Invasive' is very significant to the article because they explain how to much of the reptiles could be a ""major threats to biodiversity""."
8860,4,1,1,"The significan of the word invasive is that, the snakes are coming to our cantry and inveding our it. As shown on the map, pythons are invading the Southern part of the U.S, and coming up to the new England area."
8861,4,1,1,The word invasion is used a lot. They are using these word to describe both reptiles are invading in the article it has multiple stories of reptiles. One song said that many ''were shocked in seeing an alligator a python in its mouth.'' The reptiles are taking over and eating everything.
8862,4,0,1,"The significance of the word invasive is invasion. It shouldn't be where it's supposed to and in this article pythons are eating alligators, there going out where there not supposed to."
8863,4,1,2,"The significance of the word invasive to this article is that many reptiles have basically invaded about one third of the United States already. Pythons have already breaded abundantly in the Everglades, as stated in the article, it says that the pythons have become invasive and has become dangerous to five endangered species in the Florida keys."
8864,4,0,1,"The significance of the word ""invasive"" to the rest of the article is that some people disagree on how the word is used they're introduced.I think that inasive is passing a judgement of the pythons,he said to me its on introduction.There's different ways of using the word.They only use it once in the article."
8866,4,0,0,Invasive are a word used in the text that there was a different amount of species of reptiles or animals in the USA and around the country.
8867,4,0,0,"The word invasive is significant to the rest of the article because at the begining of the article Mac Innes thought that ""invasive is passing judgement"". However, he continued throughout the article judging other animals & humans who keep reptiles as pets."
8868,4,1,1,"The significance of the word ""invasive"" is passing judament.""Bob Roy Mac Innes says to me it's a wonderful introduction I think in the best thing to happen to the overalades in the last 200 years."""
8869,4,1,1,The word invasive is used in the article to give an idea of how the animals will adapt to their climate when they are introduced to a new area. They use the word to illustrate how pythons and other lizards adapt and thrive in many warm-weather climats.
8872,4,1,1,"The word ""invasive"" is important to the article because invasive species have a disposition to enderger species that they are not native to. The author says this is important because pythons are not native to Florida and are causing harm there."
8873,4,1,0,"Invasive would mean bringing the creature where they  should be, where they don't belong you know they shouldn't be here."
8874,4,1,1,"In the article, in paragraph 7, it states that the term invasive species is an unfair term. But the word ""invasive emphasizes the way pythons are invading homes and habitats of animall that can't afford to have them there."
8875,4,1,1,"The word invasive means when speaking in terms of animals, that the animal are not native to the area its brought into, this word in the article help explain what some animals were and how we as humans could be hurtting them by moving them around."
8876,4,0,0,I would say this for the invasive is like in you don't want the pythons at your house you will say the python is invasive my house.
8877,4,0,0,"Invasive essentially means invading something. For example, invading someones home by unwanted visitors or invading privacy is invasive."
8878,4,0,0,Invasive is way of a type of environment. Statement in use for differen animals in different environment.
8879,4,0,0,"Invasive defines the amount of reptiles being present in the united states the pythons are already one of the "" umperiling five endangered species""  in Florida keys many more a prawn to dis of strange death by using introduced into home environments. They are an invasive species that should not be a pet no to the low count of them."
8880,4,0,0,"I think the word ""invasive"" means a different animal."
8881,4,0,0,"The significance word ""invasive"" means that they are not harmful but somewhat they are. Invasive mean at some point they might go extinct but we don't know when."
8884,4,2,1,Invasive means a kind of animal that is not native to a place starts to inhabit it usally causing damage to the native species. In this artical it talks about the swamp rat found in Florida was track only to be found in the stomach of a snake. The snakes down there are not native to Florida.
8885,4,1,1,"In this article, they say that the word ""invasive"" is not a fair word and should be changed to ""introduced"" They say that it is passing judgement and just not fair to call them that . But in a way the reptiles did invade."
8886,4,0,0,"The significance of the word of invasive means that something takes up and soon takes over a place, they invade something."
8887,4,0,0,Invasive is a species or animals that can only live in warm climates and can be a threat to people.
8888,4,1,1,The significance of the word invasive to the rest of the article is that they are wild animals and they are increasing. Some people believe that its unfair to pass judgement as involve. They believe invare species are a threat to biodversty.
8889,4,2,1,"Invasive species are Burmese pythons and Lizards. Invasive species are dangerous. Skip Snow says that "" The species are imperiling five endangered species in the Florida Keys, such as the Key large wood rat. This article is about what invasive species can do and how their dangerous."
8890,4,1,1,The word invasive means to intrude come in without people waiting them there. The point of this article is saying in take them in as pets. How that they word invasive endangered and misunderstood.
8894,4,1,0,"The word invasive has a significance to the article because the main animal the author thinks about throughout the article is the python, which is an invasive species."
8895,4,0,0,The significance of the word invasive means that the  species are dangerous and they are poisinous.
8896,4,2,2,"The word invasive means that a species was brought into an area, not by means of being a native species. The article deals with contrasts between snakes being invasive to areas such as the Everglades or if they are introduced. Invasive is a negative connotation because invasive species are usually threats to biodiversity. The article deals whether or not this is true of this case."
8897,4,1,1,"The word ""invasive"" is very significant in this article. The word has a negative connetation associated with it. It suggests that these reptiles do not and should not naturally be in the Everglades. MacInnes believes that the term is unfair. He thinks it should be ""introduced"", because he is the one who brought them to the Everglades."
8898,4,1,1,"The reader can infer that invasive means a growing population of species, since this article revolves around the fact that their numbers have increased. ""Invasive species are major threats to bio diversity."" That is very serious."
8899,4,1,1,"''Invasive'' was used in the article to describe species like pythons, they're everywhere. The article shows that there are too many pythons in the Everglades and they're a growing species."
8900,4,2,1,"Invasive, or the adjective of something invading something else, was used to describe the new species. MacInnes wants to import from places such as Fiji and Madagascar. The importance of this word to the article was to contrast different people's news and opinions, while the government tries to keep them out, calling them an ""invasive species"". MacInnes differs when he says, ""the term 'invasive species' is unfair. They're 'introduced'. I think that 'invasive' is passing judgement"". Which shows the differing opinions to whether these animals should be imported or not."
8901,4,0,0,The significance of the word invasive to the rest of the article means that there are animals going extinct and they from different parts of the world. They shouldn't leave their home and they should stay where they are.
8903,4,0,0,The significance in the word invasive is that in this article this is the most used word. We even have invasive reptiles and invasive spieces. If it is so invasive why don't they just stop the population and make this extinct.
8904,4,0,0,In the article when they say invasive they are talking about how the animals can be bad if they are on certain parts of the earth.
8905,4,2,1,"The significance of the word ""invasive"" is meant to mean dangerous/native. In the article it says ""The snakes are imperiling five endangered species in the Florida keys."" The people of Florida are afraid the reptiles will harm the ecosystem of Florida's wildlife."
8906,4,1,0,"The word invasive is significance to the rest of the article because most importantly it is in the title. Another reason is how the whole article talks about the movements of invasive species being a positive or negative. The article talks about the movement of them is good for the environment, like in paragraph 7, ""when anything can go anywhere complicating invasive""."
8907,4,0,0,The word invasive in this article is taking over many new species well be considered as numbers one pets in the world. They will eventually invade other pets places and have a place in our world. An example would be how it is spreading threw out the country.
8908,4,0,0,invasive is a word that people perceive differently. This story tells that some people may find reptiles invasive and others may not.
8909,4,0,1,"The word invasive in this article means animals that are roaming in the wild and can cause danger to others. The U.S. fish and wildlife service blocked MacInnes from importing animals such as Fojo, Island iguanas, and radiated tertoises from Madagascar because they are ""invasive""."
8910,4,0,0,Invasive as an endangered and should not be a bet. The people who are calling them invasive are saying they shouldn't be pets and other are calling the regular pets.
8911,4,1,1,"The word invasive is used to describe animals coming to new locations that they shouldn't be, such as pythons going to the everglades. But MacInnes thinks that a better word would be introduction because the animals are being introduced to new places."
8912,4,0,0,"It means ""massive""."
8913,4,1,1,The significance to the word invasive is that Biologist are saying that invasive species are major threats to biodiversity. This goes against the whole articles because it's about how people should own reptiles as long as they have a license.
8914,4,0,0,"The word ""invasive"" implies that the new species is taking over. This is not always the case."
8915,4,2,2,The word invasive pertains to the rest of the article in that it is describing the animals. The term invasive is just saying how the animals forced out and go to new places and live there. Then they disrupt what is already there so essentially invasive is just saying how the animals came in and try to take over the habitat by eating and force.
8916,4,1,1,"The word ""invasive"" is important to the article. The snakes and other exotic reptiles being sold in Florida are described as invasive. They will eat the animals of Florida and will not really be hunted."
8918,4,0,0,"The word Invasive signifies the introduction of the species introduced in the article. The article stated that, ""To me it's a word introduction,"" I word ""invasive passes judgment about the article because the story claimed that its unfair to use such a word."
8919,4,0,0,"People see the words ""invasive species"" as words meaning a species that will barely nourish and is just staying for a brief moment such as pythons. Even the term 'invasive species"" is unfair...they're introduced. I think that 'invasive' is passing judgement."
8920,4,1,1,"The word invasive is important to this article because it describes how the python goes about living in this new desidor because it has no predator. These invasive species are ""unchecked by natural predators"" hating them dangerous."
8921,4,1,1,"Invasive is a big part to what makes this article stand out. The word ""invasive"" gives the dictation that they are invading and taking over like, it is a bad thing. You can tell that they still end up invading and adapting to such areas as Everglades."
8922,4,1,1,"The word ""invasive"" normallis refers to a species which has made itol at name somewhere it shouldn't be. But according to MacInner the term ""invasive species"" is unfair. According to him the pythons are introduced t that ""invasive"" is an unfair judgement past an the animals."
8923,4,1,2,"The word invasive in this article, is used in a negative manner to show that these reptiles are dangerous and scary..''the threat imposed by invasive reptiles.'' In this quote, he is saying that these dangerous reptiles are taking over because of their rapid reproduction. The word invasive shows that their reproduction is massive and dangerous."
8924,4,1,0,"The significance of the word 'invasive' in this article is that invasive is reffering to the reptiles being dangerous reptiles. The author states, ""the government overestimates the threats posed by invasive reptiles,"" meaning dangerous."
8925,4,1,1,The word invasive is significant because in the artle people are saying how the animals are introduced to the contry and are not taking over. Also invasive species could be major threats to biodiversity.
8926,4,0,1,"I believe ""invasive"" meaning passing judgement apon  something like nid in paragraph 10, ""MacInnes contaids that the government over estimates the threat pased by invasive reptiles."
8927,4,0,1,"Invasive means to invade. Pythons are invasive, which means they can invade Iguarias one another invasive species. Most people think animals like a python, a cockroach or an iguona are just an invasive species but people do have them as pets. They are easier to take care of because they do not need to be walked outside."
8928,4,1,0,"Invasive is dangerous not normal I say this because on the top of paragraph 5 it says ""But bioligists see the trade in nonnative creatures as a factor in the rising number of invasive species."
8929,4,0,1,"The word invasive in this article is important with the fact that it has a negative tone to it. The article states,""even the term invasive species is unfair, he said, they're introduced. I think that invasive is passing judgement."""
8931,4,1,1,"The significance of the word ''invasive'' is that its passing judgement, and it puts a bad look on the species being named by it. Bioligist says that invasive species unchecked by natural predators are major threats to biodiversity."
8932,4,1,0,"Invasive pretty much means that species are taking over. And like MacInnes said, they're only being introduced to the world."
8934,4,2,2,"Invasive refers to something or someone that is in a area that is not theirs, and causing harm to the natural inhabitants, such as the pythons in Florida. They were introduced to the area and have invaded into the territory up other animals. In the store it states pythons are imperiling live endangered species in the Florida keys."
8935,4,1,1,The word invasive is significant because it describes the invasive species as bad things that are not good for the environment. In the article RobRay MacInnes suggested introduced as a more neutral term. Invasive makes the new species harmful to the person who have them described as invasive.
8936,4,1,0,"Invasive in the article can be seen as a danger to other species ""The snakes of imperaring five endangered species."""
8938,4,1,1,Invasive is and important word it is negative to because the pythons are not native to Florida and they are taking it over causing big problems because they are a danger to the wildlife that lives there.
8940,4,1,1,"Invasive means like deadly, dangerous animals, reptiles such as the cobra or python. They use invasive a lot throughout the story refering to the snakes because of the snakes eating native species and some trying to eat aligators, getting an aligator fully inside of the pythons body but exploding due to masive stretching to the body a snake will try to eat anything if largeenough."
8941,4,0,0,"The word ""invasive"" is significant to the rest of the article because MacInnes believes that the word invasive is ""passing judgement."" This word has to do with the article because the article is about whether or not people should own reptiles as house pets and some people say pythons are an invasive species."
8942,4,1,1,"In the article it is said in two ways at first it says that saying ""invasive species"" is unfair because they are introduced it's past judgement. Then on the other hand invasive species, unchecked by natural predators are major threats to biodiversity."
8946,4,1,1,"Invasive means unchecked. If the species in invasive, it means it's unchecked by natural predators. Its importance in the article is one that allows the reader to understand more of the problem."
8948,4,1,1,"Significance of the word ""invasive"" means almost threatning of harmful, for example, in paragraph 9 of the article explains MacInnes says the term ""invasive species"" is unfair. ""They are introduced"" also he says, ""I think its the best thing that happened to the Everglades"", stating that invasive species are good for the Everglades instead of bad."
8949,4,1,1,"Invasive is significant because the whole article talks about how certain animals have ""gone native"" meaning they have been led out to roam free, and have thus been causing chaos among other animals."
8950,4,2,2,"Many species go on the verge of being extinct due to predators becoming more abundant to an area. The python became ""invasive"" when it began appearing in Florida, an example would be the key largo wood rat, according to the article it is one of the endangered species in the keys. Finding one with a tracker in the python's stomach concludes that this reptile is invasive."
8951,4,0,1,"""Invasive"" is a negative term used by opponents of MacInnes, pythons can make good pets.To other however pythons are simply ""invasive""."
8952,4,1,1,"The word ""invasive"" is important to this article because people are arguing that pythons are not invasive. RobRoy MacInnes suggests that pythons are ""introduced"" to their enviornments."
8954,4,1,1,"The word Invasive means that an animal is in a local habitat when its not supposed to be, the pythons were legally pets but escaped from their ownors and is now endangering local animals."
8955,4,1,1,"The use of the word invasive is very significant in this article. It can help to paint a negative picture for an orginism, in this case pythons for example it says in this article ''the term invasive species is unfair.'' This shows that ''invasive'' can produce a negative image for an animal and that is why the quote says do not call it invasive."
8956,4,0,0,"Invasive means to invade an area, this relates to the article because many animals are invading states or peoples areas."
8957,4,1,0,"The significance of the word invasive to the rest of the article is that when that are talking about the different species like lizards and snakes that are invasive because that want be kill you, they are predators, but RobRoy Mac Innes doesn't think its fair to judge those species."
8958,4,1,0,The word invasive is used to emphasize the fact that the animal is most natural to that area. They are invading more on term.
8959,4,1,2,"The word invasive is significant to the article because is describes how the animals are starting to overflow. Als it states in paragraph5, ""but biologists see the trade in normal creatures. A trade in the rising number of invasive species such as the Burmese python which is breeding up a storm in the Everglades."" Since the animals are being taken at of the habitats they are now trying to put the number has in."
