Id,EssaySet,Score1,Score2,EssayText
9235,4,1,1,"The word invasive is used throughout the article because new species that come in ""take over"" the environment. The article says the term ""invasive"" species is unfair because the animals are more introduced."
9236,4,1,1,"The significance of the word invasive is like a type that is not welcomed like in this article the reptiles are not welcomed to the w because they don't belong there, thats why in paragraph 4 the person said the term invasive species is unfair and passing judgement."
9237,4,1,1,"The word invasive to my opinion means dangerous species or reptiles like crocodile, alligators, snakes and lizard (pg4) (para 9) ''Biologist say invasive species unchecked by natural predators are major threats to biodiversity'' meaning they are a danger to humans."
9241,4,0,0,Invasive is unfair something like if you want my pencil and i want your pen you'r agree with but after i give  you my pencil you don't give me your pen thirdly certain.
9242,4,1,1,The significance of this word from the rest of the article is that the term is unfair to call animals because its passed judgement. This is evident because in the story it says ''it was the best introduction that has ever happened to the Glades in the last 200 years''.
9244,4,1,0,To my knowledge invasive sort of means threat. The significance of this word to the rest of the article is most people would consider the animals sold invasive and or a threat.
9245,4,1,1,"Invasive  is like to invade or proliferating. Like, one third of the continental U.S is potential habitant to pythons. Another example is, pythons are being spotfeel in multiple locations in remote regions of the Everglades."
9246,4,1,1,"The Significance of the word ""invasive"" is that it's basically describing something as being invading. The article said that the python was ""invasive"" because they came into a new region unexpectively."
9248,4,0,1,RoiRoy McInnes says that the term invasive is unfair. Invasive describes something that enters a local society or group without permission and causes possible trouble. This article deems some exotic animals to be invasive.
9249,4,2,2,"The significance of the word invasive in the article is that it describes a dangerous situation that is occuring in the US. An invasive species is one that is introduced into a foreign environment, and if allowed to remain, can cause much harm to environments and native species. One example is the pythons decreasing the wood rat population in the US."
9250,4,0,0,This article is mainly about python's and python's are a very invasive species.
9251,4,1,1,"In this article invasive means threat. They see reptiles as a threat because if it goes unchecked by natural predators, are major threats to biodversity that can affect wild life."
9253,4,0,0,In the article they called the python invasive and said they're more introduced. I think they're invasive and I don't think They should be considered pets at all.
9256,4,1,1,"''Invasive'' is when an organism is introduced to a new environment and kills off  the natives. In the article, the python is described as invasive because it killing out or eats natives and thrives i the new environment."
9258,4,0,0,"The significance of the word ""invasive"" is that some people feel that pets such as lizards and snakes (especially dangerous ones) belong out in the wild not in anyone's bedroom. On the other hand, some people feel like keeping reptiles as pets are great because they are low maintained and easy to take care of."
9259,4,1,1,"The word invasive relates to this article in a way, because snakes are migrating into our country. Since much of the Souths Climate is similar to the snakes climate they can live in the area, "" A USGS map showed ... python habitat stretching from CA to Delaware, including much of the South""."
9260,4,1,1,"The word ""invasive"" has a great significance in the article. The articles main question is whether or not pythons and other generalists are invading countries or not. While people such as MacInnes argue that they are just adapting to new environments, others such as Snow, argue that they are taking over. It is left to the reader to decide if the animals are ""invasive"""
9264,4,1,1,"The significance of the word ''invasive'' means something has been found a place where it wasn't found before. & pythons/snakes were seen places that they weren't seen before. In paragraph 11''what's certain is that by 2002, pythons were seen in multiple locations in the remote regions of the Everglades.''"
9265,4,1,1,"The word invasive means your coming into someones territory. In paragraph 12 we see snakes have gone invasive and are popping up in many places of the world. In this case by the snakes being invasive of other animals we are being invasive of other animals, we are now starting to see animal extinctions happen."
9266,4,0,0,"The word ""invasive"" is the base of the article. Some people, like RobRoy MacInnes, consider the word rude. While Skip Snow thinks it's the correct word to describe these animals."
9267,4,1,1,Invasive to me means taking over. I believe it means this because reptiles are becoming more common pets all over the world. It seems they're spreading around rapidly.
9268,4,1,1,The significance of the word invasive means invading like its not sapose to be here. Its a more harsh word than introduced. its like their trying to say the reptiles are taking over and the reptile population is booming.
9270,4,2,2,"These invasive species are considered invasive because they weren't supposed to originally be here. This causes an unbalance in the ecosystem. As the article states in paragraph 11, the snakes have imperiled 5 endangered species in the Florida keys. Once they went native, they didn't go back. Causing tennoil in balanced environments it makes sense they've been dubbed ""invasive""."
9271,4,1,1,"Invasive means intruding or tespassing. If you are invasive, you are unwanted. The snakes are called invasive species in this article because some feel they are unwanted, like the people of Florida. However others, like MacInnes, it is an offensive term, b/c he says they are ""introduced""."
9272,4,1,1,The word ''invasive'' is significant to the rest of the article because it makes the reader automatically think invading and then they already have their mind made up prior to even reading arguments for and against the so called ''invasive'' species.
9273,4,1,0,"I think the significance of the word "" invasive"" is ""passing judgement"". In the article says for a pythons its a good introduction because ""However invasive species unchecked by natural predators, are major threat to biodiversity for example a pythons, a crocodile, snakes, and other lethal species."
9274,4,1,1,Invasive means that the they taken over the article is mostly about pythons and how they have become an invasive species that's taking over the warmer climates almost one third of the United States.
9275,4,0,1,The significance of the word invasive is to show the reader the importance of this word. Invasive is a word that is usually viewed as a negative word but according to RobRoy MacInnes its a wonderful introduction. Invasive signifies that in order to have this description or title you must have bold features such as reptiles + snakes.
9276,4,0,0,The term invasive means that they are old and used. Pythons spread to different parts of the country so they still way be new.
9279,4,1,1,The significance of the word invasive is like an example of the pythons invading other countries. They inhabit places that have a climate one third similar to the United States.
9281,4,0,0,"The word ""invasive"" means rare or going extinct. The invasive species would be the pythons before they boomed in America. Now there are plenty of pythons. Basically, we should take better care of the endangered species. ""...Hurricane Andrew... played a factor in a wholesale python jailbreak in 1992"". Before they were endangered, but now they aren't."
9283,4,1,1,"Invasive species are animals that ""unchecked by predators, are major threats to biodiversity"", (Achenbach). It is significant to the rest of the article because the author is exploring the validity of these species being harmful to the environment and the potential dangers they present."
9285,4,2,2,"The word invaisive is significant to this article. This article talks about how pythons & other generalized species can live in countries with the same climate as their homeland. But, when these animals move to a new country they invade the enviorment of the animals that are living there. Many bad events can occur because the ecosystem in that area is disrupted by the invaision of the new organism."
9286,4,1,1,Invasive is certainly a significant need in the article. This is because it whole how python have entered the wild by being introduced or invading it then the rest of the article talks about whether as not this is a good thing for the everglades.
9288,4,1,1,Invasive is like pythons naturally living in the Everglades hey shouldn't be their and are not natural to he habitat and are less invading species.
9289,4,1,1,"The significance of the word invase is important. Mac Innes explains how the term invasive is unfair. He says, ""They're introduced, I think invasive is passing judgement."" Invasive in the article means a threat which to many means judging a animal without giving them a chance to prove the word wrong like MacInnes said."
9290,4,0,0,The significance of the word invasive to the rest the article is that what may be someones' pet like a python could be seen as dangerous or have a bad reputation among other people.
9291,4,0,1,"Invasive is a reoccurring word in this article. Pythons is an invasive species able to live and eat another. Also, many intrasive species undergo a lag before proliferating (source). Many species are not intrasive, so when it comes to pythons the main idea of the idea of the story; Intrasive is a definition to there habit. Other animals are not like them making the word so much more significant."
9292,4,1,1,"The significance of the word invasive to the rest of the article is huge. It means that certain animals don't belong in certain places. In the article many biologist say it isn't fair to even call them invasive, they are only animals and species that are introduced to a new climate and territory."
9293,4,1,1,The significant of the word invasive is that it means to have one species come in and multiply and over ran natural species.
9294,4,0,0,"The significance of the word ""invasive"" is the fact that what its trying to say is that animals that come from another place are unwelcome and probably even dangerous."
9295,4,0,0,"The word ""invasive"" means that animals that constently invade someone's home or yard."
9296,4,1,0,"The word invasive means that these reptiles or species are kind of not where they're suppost to be, they're out of their type of territory."
9297,4,0,0,"The term invasive means very dangerous. In this article, pythons, lizards and snakes may seem as rare pet in one person, but also invasive or dangerous in another person."
9299,4,1,1,Invasive is a word with negative connotation. Invasive species invade ecosystems that aren't their own and take over. Pythons are threatening endangered species in Florida.
9300,4,0,0,The significance of the word invasive to the rest of the article is that it make the reptiles not seem so bad. The whole article is all about negatives on pythons and other reptiles.
9301,4,0,0,"The word invasive is important to the story because the pythons as an ""invasive species,"" meaning they are a danger to animals all over the ubs."
9303,4,1,1,"The significance of ""invasive"" to the rest of the article is that it is describing what would happen to the places where you being these new animals. If you bang them to new a place it could damage the other wildlife live because they are not used to having this other predator around eating all their food."
9304,4,1,1,"The word invasive is used in the article one man's pet, another's invasive species. I feel the words signifiance in the article is that you either think the pythons are an invasive species or not. Some people say that invasive species are a threat to nature and others say that the word invasive is an unfair term."
9307,4,2,2,"The significance of the word ""invasive"" in this article is that these non-native animals are taking over our native animals. The article says ""invasive species unchecked by natural predators are major threats to biodiversity."" These species brought over are taking place of our own animals. The snakes, he says, are are impelling 5 endangered species in the Florida Keys"". Invasive is the right word to describe these actions."
9308,4,1,1,"The significance of the word ""invasive"" is that the article talks about invasive animals and how they are spreading around the U.S because Florida is bringing them in to the United States."
9309,4,1,1,"The word ""invasive"" is significant to the article because it is coming in and invading places where it shouldn't be. ""Invasive is passing judgement""(4). That is not the because they are invasive when they cut the animals we said to keep a live and popular."
9310,4,0,0,"The significance of the word ""invasive"" is to attack. The reptiles will do that but not all. Most household snakes doesnt even bite. They are harmless animals and very friendly if you take good care of them."
9312,4,1,1,The significance of the word invasive is obsecured. People say its unfair to use on the pythons because the python is such a snake in Florida according to (paragraph 7). One person think that its a wonderful introduction. But really invasive species are major threats to the biodiversity and news moved around the world so fast according to paragraph 9.
9313,4,1,1,"Invasive is implying that they are taking over and destroying what was there before. This word is significant because it shows that instead of the animals just living there, they are driving th old species out as well."
9315,4,0,0,"The term ""invasive"" is crucial to this article because it's harsh meaning resembles the way people think of reptiles. Reptiles, such as lizards and snakes, are generally treated badly. People are fearful and are disgursted by them. The term ""invasive"" implies harsh cold attitude like the one often given to reptiles."
9316,4,0,1,"Invasive is a very significant word. In paragraph 7 they say, ""I think that 'invasive' is meaning judgement about Animals,bugs, and also reptiles."
9317,4,1,1,Some of the scientists in this article are saying that there reptiles are invasive but their not this reptiles are being introduced to this habitat  by custrmere into purchased reptiles. And invasive is when a certain species of plant or animal invade a place where the are not native.
9318,4,1,0,"''Invasive'' is a significant word. In the article they use the word ''invasive'' as passing judgement. For example in paragraph 7, it says ''they're introduced. I think that invasive is passing judgement.'' And ''invasive'' is significant throughout the article because it talks about the python and almost how destructive it can be, but also it can be a good household pet."
9319,4,2,2,"Invasive species refer to animals/species that was introduced to an area it did originally live in. This means that other animals,spreading endangered species, will not be introduced to having them there. According to the article, pythons are endangering five species in the Florida in US. This is because they are not used to having pythons there."
9320,4,0,0,The word invasive has a lot of significance because Mac Innes believes the term is unfair and is passing judgement and the whole article is based on his studies.
9321,4,0,0,"Well in the article it states that one man's pet, another's Invasive Species."" I'm guessing the word invassive means a reptile, animals that many people don't have."
9322,4,1,1,"The word ""Invasive"" is very important to the article. It is important because this article explains how animals that are introduced to a different habitat can be harmful or ""Invasive"" to the native species."
9324,4,1,1,I believe the significance of the word ''invasive'' to the rest of the article is to be completely out  of control. The reason why I believe this is because in the article MacInnes got offended and stated ''even the term invasive species'' is unfair. ''Reading that told me that it was something harsh enough to take offense to.
9325,4,1,1,"The word invasive means in this case that the animals change rapidly. This is a threat to biodiversity, because they cant controll how fast its changing."
9326,4,1,1,I believe that describing these animals as invasive is very fitting their characteristics. These animals have invaded the everglades and its surrounding areas when there are repponts of the animals under the hood of a tourists col then the animal is definitly invasive.
9327,4,0,0,"Invasive are species like snake. In the article, it says that ""Even the term"". Invasive species"" is unfair. ""They're introduced,' that invasive is passing judgment."
9328,4,1,0,"The significance of the word ""invasive"" to the rest of the article is that invasive means like unchecked species by predators."
9329,4,0,0,Invasive means to make sure you stay and of contact of something because it is dangerous and might kill you.
9330,4,0,0,"Invasive means passing judgement, or unchecked by natural predators. This means the animals are not safe for other people."
9331,4,0,0,"Invasive to the rest of the story is taking over half the country. ""9.8 million households have reptiles""."
9332,4,1,1,Invasive is very signifacant word in this article. It is signifacant because it shows why these pythons are bad. In paragraph 9 it says that invasive species are big threats to biodiversity.
9334,4,0,0,The word invasive is significant to the rest of the article because the article is talking about pythons who are invasive species and explaining how they are becoming less and less invasive as years go by because now there are more being seen in various other locations around the world.
9335,4,0,0,Invasive was constantly used through out the article.
9336,4,0,0,"Even the term 'invasive species' is unfair, MacInnes said. They're 'introduced.' I think that ""invasive"" is passing judgement."
9339,4,0,0,"The word ""Invasive"" can mean many things but in the article it means out of control. This conclusion has been made due to the information in paragraph 7. Which happens to say ""Even the term ""invasive species"" is unfair""."
9341,4,0,1,"The significance of the word ""invasive"" in the article means to be harmful, or is harmful. The word invasive is being used to describe the pythons as harmful to man kind. The title of the story is ""One man's pet, Another's invasive species."" The title says it all. Some people accept the reptile as a pet being non-harmful, others think they are a specieces that is very harmful."
9342,4,0,0,"Invasive; one mans pet, anothers invasive species, meaning it can be someone else's pet today but later tonight when it get hungry it will be a very dangerous wild creature."
9343,4,0,0,The significance of the word invasive to the rest of the article shows that the species who do come into a new habitat are not monsters. The reason for MacInnes to say more of as''introduction species'' is b/c invasive sounds more of a bad thing when on this case it isn't.
9344,4,0,0,"The word invasive isn't a good word to use in this article be it ""is passing judgment"" and it ""is unfair"""
9345,4,1,1,The significance of the word invasive is a passing judgement stated in the article. Invasive means that it's a major threat towards biodiversity. That they are natural predators.
9346,4,1,1,They use invasive because the cobra is entering a/new enviroment  and iwf a predator that can multiply and domanate athat area like an invasion.
9348,4,0,0,Invasive in this article means that people may be invaded the reptiles space and something happened.
9349,4,1,1,"Invasive in implied as a bad thing, making the cobras seem to invade the U.S. The pythons in the U.S were from Asia so the species ""invaded"" the U.S because it was not indiginous. Also, people who don't like the world to change fast would call them invasive as it is a strong word."
9350,4,0,0,"The significance of the word ""invasive"" is that it, the word it-self passes ajudgment on to the reptiles species. Even the term ""invasive species"" is unfair."
9351,4,1,1,"The significance of the word ""invasive"" is to tell the reader how they feel about the animals. For example, the guy said they were introduces sothat name isn't necessary, but it tells the reader that other people think they shouldn't be pets and they are spreading everywhere so they are invading."
9356,4,0,0,"There is a significance to the word ""invasive"". MacInnes thinks the word invasive is unfair, ""they're introduced, I believe it is significant because there are double the amount of people now that have reptiles as pets and that invasive is a passing judgement."
9357,4,2,1,The word invasive means to invade area and take over. This word is significant because the story says ''invasive species are major threats to bio diversity.'' The word relates to the story because the story mainly about how certain species can live anywhere causing problems in the habitat they go to.
9358,4,1,1,"The significance of the word invasive to the rest of the article is that pythons have not been brought into society in a good way. In the text it say, They're introduced I think that invasive is passing judgement"" This shows that people aren't accepting the fact that pythons aren't bad."
9363,4,0,0,"In the article it says a a snake like that coming at you, you'd leave him alone.Another thing it says in the article is a invasive species is unfair be sound. They're introduced."
9364,4,0,0,The significance for the word ''invasive'' in this article is that it's explaining another name for foreign animals. Pythons arn't exactly considered a common pet like a dog or a cat.
9365,4,0,1,"The word invasive is significant because it is saying that someone is judging the reptiles. They are judging that all the reptiles are going to be dangerous and not safe to become pets. They think people are bringing them into America just to do it, when they are ""introducing"" them."
9366,4,1,1,"I think invasive means same of the species that aren't really a natural predators. "" Biologists, however, say that invasive species, unchecked by natural predators, are major threats to biodiversity""."
9368,4,1,1,The word invasive says that the reptiles are begining to spread too wildly across the U.S. invasive is significant because it shows an opinion about the article.
9369,4,1,1,"The significance of the word ""invasive"" is saying how animals such as reptiles are everywhere. Now for example the author in one man's pet, Another's invasive species, the areas are increasing in numbers because ""man""s adapting that reptiles to other places."
9370,4,1,1,"The word ""invasive"" might reflect the rest of the article because the word means to invade or so this might relate to the author species, such as reptiles and other species when going into another inocustomated environment not on its own."
9371,4,0,0,"The word ""invasive"" is when you go somewhere what you are not dispost to go."
9372,4,0,0,In the article it said that pythons are invasive some people dont think its unfair to call them that.
9373,4,1,1,"Invasive specie refers to a specie that has adapted and lives in certain parts of the world or country according to climate. The map even shows that Americas Southern States are home to snakes because of their climate. ""A uses map showed potential python habitat stretching from California to Delaware and including much of the south."" para 15."
9374,4,0,0,Invasive are unchecked natual predators a threat to us civalization.
9375,4,1,1,"The word invasive in this article most likely was being used to say reptiles as pets in the U.S. are either gross, not night or even unwanted. ''Even the tern invasive species is unfair'' says MacInnes. MacInnes believes that reptiles do have the right to be in households throughout the U.S, even if many believe snakes and lizards are invasive."
9376,4,1,1,"The significance of word ""invasive"" was used very times i the story. As in the story it said ""MacInnes contends that the government over estimates the threat posed by invasive reptiles. My opinion is that they are explaining how some reptiles are very harmful to the environment. This is my reason of the significance of the word invasive."
9377,4,1,1,"The word ""invasive"" is significant to the rest of the article because they are spreading allover ""the map, ""the U.S geological survey reported that pythons in Asia inhabit climates that are similar to those in about a third of the continental united states"" pythons are found  almost everywhere but without all invitations."
9379,4,1,1,The word invasive comes from the word invade which means to go into a place unwelcomed and unexpected. The word relates to the rest or the article because the the tittle says ''one mas pet another's invasive species'' and two the story discusses how the animals are being invasive in paragraph 11-17.
9380,4,1,1,"The word invasive would be considered as something uninvited or unwelcomed. But in the article the word invasive is unfair and judgemental. As MacInnes said in paragraph 7, he finds these ""invasive species"" to be actually introduced species."
9383,4,0,0,"The significance of the word ""invasive"" is that it pertains to the story well because the python is very "" Invasive"" of other animals and species around it."
