Id,EssaySet,Score1,Score2,EssayText
8439,4,1,0,"The word invasive is unfare because it describes the type of species. Multiple time in the article the phrase ''invasive species'' is used. Also, Mac Innes doesn't agree with this term because he feels as if it is unfair. ''They're introduced. I, think that 'invasive' is passing judgement.''"
8442,4,1,1,"The significance of the word ""Invasive"" is to tell the reader about foreign animals that are brought to the U.S from around the world. ""...the government overestimates the threat posed by invasive reptiles. (paragraph 6) is used to make readers assume that the environment is threatened by animals that are clearly not native to the U.S."
8443,4,1,0,"I n the article they use the term ""invasive"" , meaning a dangerous specie. Also, saying that they are a threat to the ones they prey on or more aware there doin."
8444,4,1,1,"The significance of the word ""invasive"" to the article is that it shows what these reptiles are doing by coming to America. They are coming and invading areas like the Everglades and Cape coral by breeding and raising their population. Additionally ""invasive"" shows an opinion of the snakes because they could be known to be introduced instead of invaded."
8445,4,0,1,"The significance of the word ""invasive"" means that its different, unique in the way it is. In the article it states""even the term"" invasive species is unfair, he said, ""they're introduced. 'I think that 'invasive' is passing judgement"". They're many animals that can be invasive species."
8446,4,1,1,"The invasive species, is called like this unchecked by natural predators, are major threats to biodiversity."
8448,4,0,0,"The way the word ""invasive"" is used in the article is to show that having reptiles as pets in bad. The others says that these creatures are being brought in as pets and that if it continues, that they will practically be invading humans."
8449,4,0,1,"The word invasive is used to describe how humans see reptiles as these new scaly creatures being brought into a country not used to them.You'd leave them alone or die of fright(Achenbach). Many people are afraid of these reptiles when they shouldn't be. The term invasive is unfair he said, ""they're introduced""(Achenbach). When you hear invasive, you think dangerous but writer roel Achenbach claims they are not and the name doesn't fit. They are just new."
8450,4,0,0,"The word ""invasive"" is important to the rest of the article. Because not all animals are harmful, or dangerous like judge. Such as the ""invases"" Fiji Island iguana, or the radiated tortois from Madagascar. As talk about in the article ""one man's pet, another invasive specie"" by Joel A."
8451,4,1,1,"The significance of the word ""invasive "" is that it means an animal is purposefully trespassing or ""invading"" another creature territory where the word ""introduced"" is significant because it means that an animal was bought or taken to another creature territory by a third party, whether it be a human or another animal. ""Even the term invasive species is unfair he (Mr Inner said  'They're introduced' I think that ""invasive is a passing judgement of the pythons he (Mc Inners) said,to me it's a wonderful introduction I think it's best thing to happen to the everglades in the last 200 years."
8452,4,1,1,"Invasive is being used to say how unsafe some reptiles are to have, as pets. It's a warning for people, not to bring them into their homes. ''Biologists, however say that invasive species, unchecked by natural predators, are major threats to biodiversity,'' (p.9). These reptiles being in the wild, not around people."
8453,4,0,1,"The significance of the word ""invasive"" of this article is that by being dangerous reptiles like pythons, and Nile monitor lizards as pets can cause a danger to lead this particular animals artist. Also that it is causing more of the python species to be more in local areas, instead of their natural habitat. So by the author using that word ""invasive"" he or she wanted the reader to get the importance of having the reptiles as pets."
8454,4,1,1,"The word invasive deals with the concept that these ""introduced"" species can cause significant damage to ecosystems by affecting the natural order. For example dealing with reptiles, the article goes on to describe how pythons threaten many endangered species is areas like the everglades when they are introduced. The article points out the problems with introducing what it really sees as harmful, ""invasive"" species."
8455,4,0,0,The word invasive means in the article that people are judging pythons as a bad species because they would eat anything that get in their way of moving or when they are look for food to eat.
8456,4,0,0,"The word ""invasive"" is significant word to the rest of the article because the author is talking about invasive animals, such as the python."
8458,4,0,0,Invasive is like the same animals but different body parts.
8459,4,0,0,"The significance of the word invasive in this article is it describes how people of the U.S are categorizing reptiles. It puts it in a not open area to others, for example, MacInnes says "" I think that invasive is a passing judgement."""
8460,4,1,1,"Throughout the article; ""invasive"" has an impact on the reader's perception of the situation while invasive makes the reptiles seen threatening, MacInnes says ""they're 'introduced'. I think that 'invasive' is passing judgement.'' This shows that while the article implies a meaning, it doesn't hold time for other people throughout the article."
8462,4,0,0,For think they are saying it like other species are being looked at.
8464,4,1,1,"In the article ""One Man's Pet, Another's Invasive species"", they use invasive to explaine how some animals are a threat to biodiversity. MacInnes, stated that he thinks people judge the species forlex, pythons. MacInnes thinks pythons are a wonderful introduction, while others dissagree."
8465,4,1,1,The word invasive is illistrated in the article by making pythons seem that they would be invading new lands. If they were moved from their native location. This is shown in paragraph 6 stating that animals from Fiji and Madagascar should not be in the US.
8466,4,1,1,"The word invasive means to be introduced into something like reptiles are invasive, when they escape homes and adapt to the outside world. This can affect the entire ecosystem. Like the endangered wood rat, which is being played on by snakes in Florida. That have radomly showed up ever a few years."
8467,4,0,1,"The significance of the word invasive means more dangerous. In the article I quote ""Even the term invasive species is unfair, he said"". ""They're introduced. I think that invasive is passing judgement"". I believe yes pythons are dangerous but maybe he is right it is passing judgement before you see if they are invasive species."
8469,4,1,2,"Invasive is important because it shows the bias against the new species, "" Even the term 'invasive species' is unfair, they're introduced; I think that 'invasive' is passing judgement"". This is important because the article talks about how invasive species were invading other new ecosystems and, are a major threats to biodiversity"", which shows how invasive is representing a bias towards the generalist species because of that harm they do."
8470,4,2,1,The significance of the word invasive in this article means that pythons and other adaptible creatures are spreading rapidly into other areas. And without being checked or  controlled the species could over popullate and unbalance the surrounding ecosystem.
8471,4,0,1,"The word ""invasive"" is a significance to the rest of the story because the article explains how snakes and reptiles are growing in America. The word ""invasive"" is passing judgement though."""
8472,4,1,0,"The word ""invasive"" is a word to describe something that is invading. In this article the pythons are an invasive species and are invading the everglades."
8474,4,1,1,"The word ""invasive"" is significant to the article because some say it is an unfair term to use, when describing the reptiles. MacInnes thinks ""that 'invasive is passing judgement"" (Achenbach 4) and they should be called 'introduced' calling them invasive takes negative look on them and 'introduced' is a more positive, open mindset."
8475,4,1,1,"The article states ""invasive species"" is unfair, they are ""introduced."" The pythons appeared in the Everglades are rather than it tory invasive, it's a good thing, best thing to python in the Everglades in the last 700 years."" (Page 4 paragraph 8)"
8476,4,0,0,"The significance of the word Invasive is away significant because saying that A species is invasive is an under statement to the amere and scientists. Basically, I think they are trying to say they are more dangerous than they seem."
8478,4,1,0,Invasive is important word because that is what the artical circles around was the python invasive or was it pertosly inter dosed.
8479,4,2,2,"Invasive refers to a species that has begun to live and reproduce in an area other than to their natural ecosystem. In the artical, pythons areInvading the American South. They begins as pets but somehows escape into the wild. there, the pythons reproduce and their population i.e harming five endangered species in tile area. Robroy Mac Innes believes the pythonInvasion is "" The best thing to traped in the Everglades in the last 200 years "", but obviously theInvasion to harming the local wildlife'"
8480,4,0,0,The significance of the word invasive is when animals that are a big threat to us reproduce fast and it alarms us of being awarid of this dangerous species.
8481,4,1,1,"The word ""invasive"" is significant to the article because the author argues that reptile that kill other animals are misunderstood rather than invasive. Invasive means dangerous and the government classifies pythons to be invasive, while the author says they are not."
8483,4,0,0,"The way the article portrais invasive is bad. They think that new special is a bad thing but as the article says, "" it's not fair"", its passing judgment""."
8485,4,0,0,This is supposed to be an article with no judgemental word. It's like certain animals are invasive and big threats while others aren't. That's passing judgement.
8486,4,1,0,"The word ""invasive"" is significant to the rest of the article because it talks about the animals ""invading"" their environment. Its not invading its introduced, the animal is just seeing what its like."
8487,4,1,1,"Invasive is a very significant word in this article. It's a significant word because it describes the problem adressed in this article, that complications could follow as animals move to more and more habitats. For example the article adresses pythons as an ""invasive species"" because they are moving to new and different habitats."
8489,4,1,1,"Invasive is used throughout the article to show that reptiles can be shown as a threat people think that the term ""invasive"" for a specias is not right at that it is a ""passing judgement"" yet people such as biologst say that invasive species are threats to biodiversity."
8491,4,1,1,"I think the significance of the word invasive is animals that always move around to places there not supost to. Biologists say that invasive species, unchecked by natural predators, are major threats to biodiversity. I think if invasive species are dangerous they should not be around people."
8492,4,0,0,Invasive in this article means the opposite of introducing. To some inasive meant passing judgement.
8493,4,1,1,"The word invasive is like saying that most of the species this dude catches are very harmful and deadly to human kind and maybe other animals too. In paragraph 5, it states ""But biologists see the hade in nonnactive creatures as a factor in the asing number of invasive species..."""
8495,4,1,1,"The significance of the word ""invasive"" is to show that reptiles from out of the country, such as a crocidile, monitor lizard, and many pythons, are dangerous to us and are major threats to biodiversity. The article wants to tell reader that buying these wild animals is not good and is as if this in the article, invading many people's homes."
8496,4,1,1,"To me invasive means to invade or spread to other parts of the world just like the reptiles do, the have migrated from south america all the way to southern parts of the US."
8497,4,1,1,"An invasive species is a species that is brought or moved to a place that they are not native to. This can cause harm to the food chain and to the habitat. The term invasive is significant because it explains what the issue is. If you didn't know what it meant, the article would make less sende."
8498,4,0,0,The word invasive is significane to the article because macinnes dosnt think that there invasive and the government is just passing judgement on the reptiles.
8499,4,1,1,Invasive is like another word for invading. In the article it says that Pythos are invasive animals. It's almost like pythons are invading a new area they have to re-adapt and proliferate somewhere different or new.
8500,4,1,1,"The significance of the word ""invasive"" to the rest of the article is that it's about reptiles (mainly snakes) are coming and spreading all over the world and it could harm the ecosystem. In the article it said that invasive species, unchecked by natural predators, are major threats to biodiversity."
8502,4,1,1,"The word ""invasive"" is used to describe species that invade our habitats"",...invasive species...are major threats to biodiversity"". When they invade they throw off food chain and the natural order. ""...a python swallowed an alligator""."
8503,4,1,1,Invasive means banging or interrupting something that lives normally. In the article pythons are including different species homes and killing native animals which are almost extinct. The invasion is taking place because somehow pythons got loose from one area and traveled to another.
8504,4,0,0,"According to the article the word invasive is like saying dangerous They are calling animals such as pythons, crocodiles, scorpions invasive and they are dangerous animals to have in other word invasive fits the desribtion of these animal."
8505,4,2,2,"The word ""invasive"" means to intrude and perhaps disrupt. The article contrasts between two opinions on calling species like foreign snakes ""invasive."" MacInnes believes that it is unfair to call these species invasive because they are ""introduced"" in a balanced way into the environment. Others believe those species are truly invasive because they are disrupting the biodiversity of the environment. Thus, opinions on ""invasive"" species vary."
8508,4,1,0,"The world ""invasive"" describes that something is invading & causing harm. The article is trying to disprove that reptiles are invasive."
8509,4,0,0,"The significance of the word ""invasive"" is passing judgement. In paragraph # 7, They explaine about ""invasive species"" is unfair. It's almost like people are saying they just don't care."
8510,4,0,0,"The significance of the word ""invasive"" to the article means its ment to give you a clear understanding on how animals live. To show you that some animals need help and cant be thrown in the wild."
8511,4,2,2,"The significance of the word ""invasive"" to the rest of the article is that species are taking over habitats that are not there own and changing the food chain. ""Biologists, however say that invasive species, unchecked by natural predator, and major threat to biodiversity"" (4) The significance of the word ""invasive"" is to show the reader how that nonnative animals could make natives animals become extinct."
8513,4,1,1,"The article talks about certain species that are not native to an area being introduced to it by humans, and because they have no natural predators there, the throw the food chain into confusion."
8514,4,0,1,"The word invasive is significant to this article because it causes readers to think that pythons and other reptiles are ""invading"" where they shouldn't. A reptile seller Rob Roy MacInnes even said ""the term ""invasive species is unfair."" This shows that even proffessionals are mis guided by the term ""invasive."""
8515,4,0,0,"The significance of the word ""invasive"" in this article would be that reptiles are not really known about. But this article says that ""They're Introduced"" meaning that saying there invasive would not be true because alot of people have knowledge about reptiles."
8517,4,0,1,"The significance to the word ""invasive"" to the rest of the article is its shows how much the people don't like the idea. According to Rob Roy MacInnes, ""The tern ""invasive species"" is unfair."" In other words it's kind of a form of disrespect in a way."
8518,4,0,0,"The significance of the word ""invasive"" to the article is that snakes are invasive to skip snow. Invasive is how they describe the snake species to be. The little is ""one man's pet, Anothers Invasive species."" So it shows how important snakes air to Skip Snow."
8519,4,0,0,The significance of the word ''invasive'' is meaning passing judgement.
8521,4,1,1,"The word ""invasive"" significance to the article means when unchecked by natural predator are major threats to biodiversity."
8522,4,0,0,The signifigence of the word invasive is that people are calling it an inasive species.
8525,4,1,1,The significance of the word invasive in this article is that the author is trying to say that pythons are bread over here and were introduced to the area and they adapted to the area.
8526,4,2,2,"The word ""invasive"" can be used to describe a species that is not native to a land, therefore invading it. The author explains how invasive species ""are major threat to biodiversity"". Nonative animals invade a land and sort of offset the balance of nuture in that area. This is significant to the entire article because the author is making the reader aware that invasive species are harmful."
8527,4,0,0,"The significance of the word ""invasive"" to the rest of the article is important, as many people believe the python is an invasive species to the U.S."
8528,4,1,0,"The significance of the word invasive is, something that is taking over or may be invading. The think the reptiles are trying to take over."
8529,4,1,1,"Invasive is significant to the article because it means dangerous is a sense. The pythons throughout the article are explained as something harmful. An example of this is how it's able to swallow a rat. Although some believe that it's okay and harmless, invasive species means something not seen everyday and harmful."
8530,4,1,1,"The significance of the word invasion is important because biologist say that invasion are speices, unchecked by natural predators which are major threats to biodiversity also it is a passing judgement."
8531,4,1,1,The word invasive from the article would mean that an animals homeland or habitat is getting invaded. The pythons and other animals are going where they aren't supposed to be which is killing other species of animals.
8532,4,1,1,"The word invasive is significant to the article because it describes pythons and other reptiles so well. Invasive means that they can take over or invade, a region rely easily because they are generalists."
8534,4,1,1,"The significance of the ""invasive"" to the rest of the article is that its unfair to call reptiles invasive. ""Invasive"" passes judgment, they were introduced. Some people think its good that these invasive animals were introduced and some think it's bad."
8535,4,0,0,The animals are brought in and have to feid for themselves. Some do it very well.
8536,4,1,0,The word invasive is significance to the rest of the article because the article is pointing out affets of having different species go to other countries & climates.
8538,4,0,1,"The word ''invasive'' means ''unfair passing judgement'' like something had happen something ugly thing like invasive species. Such as the hurmes python which is breeding up a storm in the Everglades and the nice monitor lizard, a toothy carnivore that can reach seven feet in length and has found a happy home along the canals of cape coral."
8539,4,2,1,"""Invasive"" is a significant word to the rest of the article because it is suggesting they are unwelcome in the Everglades. MacInnes says however that it is a wonderful introduction and beneficial to the Everglades which shapes the article because it went on to discuss other animals ending up in other habitats and how it's affected, itself and the environment."
8540,4,1,1,"''Invasive'' is a significant word in the article because they are calling the reptiles invaders to areas where they weren't found before. Areas like the Everglades didn't have pythons before, but they have the pythons now and they are adapting the ecosystem."
8541,4,1,1,The word invasive is important because it is used to describe how foreign animals are beginning to become native animals. The are invading our country and killing some of the natural creatures that live here.
8543,4,1,1,"The word invasive is discussed in the article. The government over estimates the threat posed by these invasive creatures like reptiles. Also, the term is discussed to be unfair. The article argues that they are ""introduced"", so we bought them here, and 'invasive' would be ""passing judgement"" as said in the article."
8544,4,1,1,The significance of the word invasive to the article would be how fast animals are populating. In the article is talking about how much snakes the country and if it's dangerous for the rates of snakes group.
8545,4,0,0,"Invasive is another word for ignored, ignoring the extreme danger. The use of the word invasive is describing animals mentioned in the story such as, crocodiles, scorpions, rattlesnakes and cobras. Species that can cause serious harm to human and other species and are being ignored."
8547,4,0,1,"The significance of the word ""invasive"" to the rest of the article is that the whole article is telling you how the python isn't ""invasive"". The article says the python is not invasive it is just being introduced to the United States."
8548,4,1,1,"The word ""invasive"" is used in ""invasive species""  in the article. An invasive species, like the Burmese python or the Nile monitor lizard, are species that have been moved to a different habitat and have ""invade"" the new environment. These speies are ""invasive"", and the question of whether or not they are a good thing is questioned throughout this article. ""Invasive"" is a significant term in regards to the whole article."
8549,4,0,0,The significance of the word invasive in the articles mean danergous.
8551,4,1,1,"After reading this article the significance of the word ""invasive"" means something like a ""pest"", ""trouble"". ""unwanted"", say this because pg 9... Biologist, however , say that invasive species unchecked by natural predators, are many threats in biodiversity."
8552,4,2,2,The word invasive is particularly important to the article because it describes foreign reptiles in America. Many reptiles such as snakes and lizards have invaded America. They are killing off natural animals such as the key largo wood rat. These foreign predators are taking root because of humans and there condessness. America is being invaded and steps in stop it need to be taken.
8553,4,1,1,"I think that invasive means they are unchecked and unknown to native population .The text states ""The term  invasive species species is unfair they're ""introduced"" (Achunbach).Based on the texturel support I can infer that invasive is a word to describe something that's not native but rather newly presented."
8554,4,0,0,"I think that ""invasive"" means some species because it says that the invasive species undergo a lag before prolicewalings."
8556,4,0,0,The significance of the word invasive is dangerous species. In this story people are trying to say where invasive species will be held and how they are harmful. Some people say invasive species are not harmful.
8557,4,0,0,The word invasive is significant because it is a passing judgement. It makes it seems like the species are introduced as it says in the article. Which is unfair and shouldn't be tolerated.
8558,4,1,1,Invasive means that different animals are starting to spread to different places and adapt to their surroundings for example the article states that a snake tried to eat an aligator to survive.
8559,4,1,1,The word 'Invasive' is significant because it relates to what they were saying in the article about pythons spreading. For example in the article it says that pythons have been seem in multiple pieces. This shows that they are invasive.
8560,4,0,1,"Invasive is vary important word for this article. I think invasive mean dangerous or endangered. ""...Placing number of invasive species. Such as the Burmese python"" (5). When I think of a snake or python I think harmful and dangerous. As you can see, this is why invasive is significant in this article knowing it takes about multiple dangerous animals."
8561,4,1,2,Invasive is an animal that is not native to a area but adapts to the differences and continues to live and postulate there. Cobras and other reptiles are an example of an invasive species because they have a wide range of apetite an can survive different conditions. Invasive species are often a problem and hurt the native wildlife.
8564,4,1,2,"The word invasive is used to describe many of the species referenced in the article, but mainly pythons. Reptile sellers disagree with the idea the pythons and other reptiles are invading habitats. They're not meant to be in wildlife specialist however, are labeling these species very inasive for they do not belong in places like the Everglade for a reason."
